<?xml version="1.0" encoding="UTF-8"?>
<!DOCTYPE tmc-service-paragraph SYSTEM "../dtd/paragraph-contents.dtd">
<tmc-service-paragraph><pub id="RM25T0E"><servcat id="_51"><name>Engine / Hybrid System</name><section id="_029759"><name>1HZ ENGINE CONTROL</name><ttl id="_0135351"><name>ECD SYSTEM</name><para id="RM100000000FJHA" category="J"><dtccode/><dtcname>TC and CG Terminal Circuit</dtcname><subpara id="RM100000000FJHA_01" category="03"><name>DESCRIPTION</name><content5><ptxt>Terminal TC is located in the DLC3.</ptxt><ptxt>The DLC3 is located in the vehicle interior. When terminal TC is connected with terminal CG, DTCs can be read from the glow indicator light in the combination meter assembly.</ptxt></content5></subpara><subpara id="RM100000000FJHA_02" category="03"><name>WIRING DIAGRAM</name><content5><figure type="1" translate="E"><graphic graphicname="A190479E03" width="7.168479331in" height="2.799876969in"/></figure></content5></subpara><subpara id="RM100000000FJHA_03" category="10"><name>CAUTION / NOTICE / HINT</name><content5><atten4><list1 type="unordered"><item><ptxt>Even though terminal TC is not connected with terminal CG, the glow indicator light may blink.</ptxt></item><item><ptxt>For the above phenomenon, the likely cause is an open or short in the wire harness, or malfunction inside the emission control ECU.</ptxt></item></list1></atten4></content5></subpara><subpara id="RM100000000FJHA_06" category="01"><name>PROCEDURE</name><testgrp id="RM100000000FJHA_06_0001" cellposition="1-1"><testtitle>INSPECT DLC3</testtitle><content6><test1><ptxt>Measure the voltage according to the value(s) in the table below.</ptxt><spec type="voltage"><title>Standard Voltage</title><table><tgroup cols="3"><colspec colname="col1" colwidth="1.38in"/><colspec colname="col2" colwidth="1.38in"/><colspec colname="col3" colwidth="1.37in"/><thead><row><entry align="center" valign="middle"><ptxt>Tester Connection</ptxt></entry><entry align="center" valign="middle"><ptxt>Switch Condition</ptxt></entry><entry align="center" valign="middle"><ptxt>Specified Condition</ptxt></entry></row></thead><tbody><row><entry align="center" valign="middle"><ptxt>I17-13 (TC) - I17-4 (CG)</ptxt></entry><entry align="center" valign="middle"><ptxt>Ignition switch ON</ptxt></entry><entry align="center" valign="middle"><ptxt>11 to 14 V</ptxt></entry></row></tbody></tgroup></table></spec><spec type="other"><title>Result</title><table><tgroup cols="1"><colspec colname="col1" colwidth="4.13in"/><tbody><row><entry align="center" valign="middle"><ptxt>Proceed to</ptxt></entry></row><row><entry align="center" valign="middle"><judge-value label="1"><ptxt>OK</ptxt></judge-value></entry></row><row><entry align="center" valign="middle"><judge-value label="2"><ptxt>NG</ptxt></judge-value></entry></row></tbody></tgroup></table></spec><figure type="1" translate="C"><graphic graphicname="A191618C06" width="3.434793307in" height="3.434793307in"/><callout><table pgwide="0" type="caption-table"><tgroup cols="2"><colspec colname="col1" colnum="1" colwidth="0.69in"/><colspec colname="col2" colnum="2" colwidth="2.75in"/><tbody><row><entry align="center" valign="middle"><ptxt>*a</ptxt></entry><entry><ptxt>Front view of wire harness connector</ptxt><ptxt>(DLC3)</ptxt></entry></row></tbody></tgroup></table></callout></figure></test1></content6><results><result label="1" cellposition="1-1"><action actiontype="end" cellposition="2-1"><actiontitle>REPLACE EMISSION CONTROL ECU</actiontitle><content6><ptxt>Click here<mlink><xref label="Seep00001" term-id-from="001" href="RM100000000FJQS"/></mlink></ptxt></content6></action></result><result label="2" cellposition="1-2"><action actiontype="next" cellposition="2-2" childid="RM100000000FJHA_06_0003"/></result></results></testgrp><testgrp id="RM100000000FJHA_06_0003" cellposition="2-2"><testtitle>CHECK HARNESS AND CONNECTOR (DLC3 - BODY GROUND)</testtitle><content6><test1><ptxt>Measure the resistance according to the value(s) in the table below.</ptxt><spec type="resistance"><title>Standard Resistance</title><table><tgroup cols="3"><colspec colname="col1" colwidth="1.38in"/><colspec colname="col2" colwidth="1.38in"/><colspec colname="col3" colwidth="1.37in"/><thead><row><entry align="center" valign="middle"><ptxt>Tester Connection</ptxt></entry><entry align="center" valign="middle"><ptxt>Condition</ptxt></entry><entry align="center" valign="middle"><ptxt>Specified Condition</ptxt></entry></row></thead><tbody><row><entry align="center" valign="middle"><ptxt>I17-4 (CG) - Body ground</ptxt></entry><entry align="center" valign="middle"><ptxt>Always</ptxt></entry><entry align="center" valign="middle"><ptxt>Below 1 Ω</ptxt></entry></row></tbody></tgroup></table></spec><spec type="other"><title>Result</title><table><tgroup cols="1"><colspec colname="col1" colwidth="4.13in"/><tbody><row><entry align="center" valign="middle"><ptxt>Proceed to</ptxt></entry></row><row><entry align="center" valign="middle"><judge-value label="1"><ptxt>OK</ptxt></judge-value></entry></row><row><entry align="center" valign="middle"><judge-value label="2"><ptxt>NG</ptxt></judge-value></entry></row></tbody></tgroup></table></spec><figure type="1" translate="C"><graphic graphicname="A191618C07" width="3.434793307in" height="3.434793307in"/><callout><table pgwide="0" type="caption-table"><tgroup cols="2"><colspec colname="col1" colnum="1" colwidth="0.69in"/><colspec colname="col2" colnum="2" colwidth="2.75in"/><tbody><row><entry align="center" valign="middle"><ptxt>*a</ptxt></entry><entry><ptxt>Front view of wire harness connector</ptxt><ptxt>(DLC3)</ptxt></entry></row></tbody></tgroup></table></callout></figure></test1></content6><results><result label="1" cellposition="2-2"><action actiontype="next" cellposition="4-2" childid="RM100000000FJHA_06_0004"/></result><result label="2" cellposition="2-3"><action actiontype="end" cellposition="3-3"><actiontitle>REPAIR OR REPLACE HARNESS OR CONNECTOR</actiontitle><content6/></action></result></results></testgrp><testgrp id="RM100000000FJHA_06_0004" cellposition="4-2"><testtitle>CHECK HARNESS AND CONNECTOR (DLC3 - EMISSION CONTROL ECU)</testtitle><content6><test1><ptxt>Disconnect the emission control ECU connector.</ptxt></test1><test1><ptxt>Measure the resistance according to the value(s) in the table below.</ptxt><spec type="resistance"><title>Standard Resistance</title><table><tgroup cols="3"><colspec colname="col1" colwidth="1.38in"/><colspec colname="col2" colwidth="1.38in"/><colspec colname="col3" colwidth="1.37in"/><thead><row><entry align="center" valign="middle"><ptxt>Tester Connection</ptxt></entry><entry align="center" valign="middle"><ptxt>Condition</ptxt></entry><entry align="center" valign="middle"><ptxt>Specified Condition</ptxt></entry></row></thead><tbody><row><entry align="center" valign="middle"><ptxt>I17-13 (TC) - A31-14 (TC)</ptxt></entry><entry align="center" valign="middle"><ptxt>Always</ptxt></entry><entry align="center" valign="middle"><ptxt>Below 1 Ω</ptxt></entry></row><row><entry align="center" valign="middle"><ptxt>I17-13 (TC) or A31-14 (TC) - Body ground</ptxt></entry><entry align="center" valign="middle"><ptxt>Always</ptxt></entry><entry align="center" valign="middle"><ptxt>10 kΩ or higher</ptxt></entry></row></tbody></tgroup></table></spec><spec type="other"><title>Result</title><table><tgroup cols="1"><colspec colname="col1" colwidth="4.13in"/><tbody><row><entry align="center" valign="middle"><ptxt>Proceed to</ptxt></entry></row><row><entry align="center" valign="middle"><judge-value label="1"><ptxt>OK</ptxt></judge-value></entry></row><row><entry align="center" valign="middle"><judge-value label="2"><ptxt>NG</ptxt></judge-value></entry></row></tbody></tgroup></table></spec><figure type="1" translate="C"><graphic graphicname="A311450C02" width="3.434793307in" height="4.677165354in"/><callout><table pgwide="0" type="caption-table"><tgroup cols="2"><colspec colname="col1" colnum="1" colwidth="0.69in"/><colspec colname="col2" colnum="2" colwidth="2.75in"/><tbody><row><entry align="center" valign="middle"><ptxt>*a</ptxt></entry><entry><ptxt>Front view of wire harness connector</ptxt><ptxt>(DLC3)</ptxt></entry></row><row><entry align="center" valign="middle"><ptxt>*b</ptxt></entry><entry><ptxt>Rear view of wire harness connector</ptxt><ptxt>(to Emission Control ECU)</ptxt></entry></row></tbody></tgroup></table></callout></figure></test1></content6><results><result label="1" cellposition="4-2"><action actiontype="end" cellposition="5-2"><actiontitle>REPLACE EMISSION CONTROL ECU</actiontitle><content6><ptxt>Click here<mlink><xref label="Seep00001" term-id-from="001" href="RM100000000FJQS"/></mlink></ptxt></content6></action></result><result label="2" cellposition="4-3"><action actiontype="end" cellposition="5-3"><actiontitle>REPAIR OR REPLACE HARNESS OR CONNECTOR</actiontitle><content6/></action></result></results></testgrp></subpara></para></ttl></section></servcat></pub></tmc-service-paragraph>