<?xml version="1.0" encoding="UTF-8"?>
<!DOCTYPE tmc-service-paragraph SYSTEM "../dtd/paragraph-contents.dtd">
<tmc-service-paragraph><pub id="RM25T0E"><servcat id="_54"><name>Brake</name><section id="_029873"><name>BRAKE CONTROL / DYNAMIC CONTROL SYSTEMS</name><ttl id="_0135612"><name>ANTI-LOCK BRAKE SYSTEM</name><para id="RM100000000FKQC" category="C"><dtccode>C1337</dtccode><dtcname>Diameter of the Tire is not Uniform</dtcname><subpara id="RM100000000FKQC_01" category="03"><name>DESCRIPTION</name><content5><ptxt>The brake actuator assembly (skid control ECU) measures the speed of each wheel by receiving signals from the speed sensors.</ptxt><ptxt>These signals are used for recognizing that all 4 wheels are operating properly.</ptxt><ptxt>Therefore, all wheel signals must indicate the same speed.</ptxt><table type="dtc-explan-table" pgwide="1"><tgroup cols="4"><colspec colname="1" colwidth="1.77in"/><colspec colname="2" colwidth="1.77in"/><colspec colname="3" colwidth="1.77in"/><colspec colname="4" colwidth="1.77in"/><thead><row><entry align="center" valign="middle"><ptxt>DTC No.</ptxt></entry><entry align="center" valign="middle"><ptxt>Detection Item</ptxt></entry><entry align="center" valign="middle"><ptxt>DTC Detection Condition</ptxt></entry><entry align="center" valign="middle"><ptxt>Trouble Area</ptxt></entry></row></thead><tbody><row><entry align="left" valign="middle"><data-name name="dtc-code"><ptxt>C1337</ptxt></data-name></entry><entry align="left" valign="middle"><data-name name="detect-item"><ptxt>Diameter of the Tire is not Uniform</ptxt></data-name></entry><entry align="left" valign="middle"><data-name name="dtc-detect-cond"><ptxt>The following occurs in 3 consecutive trips:</ptxt><ptxt>At a vehicle speed of 20 km/h (12 mph) or more, there is a difference of 20% or more in the average speed between the front wheels and rear wheels for 20 seconds or more.</ptxt></data-name></entry><entry align="left" valign="middle"><data-name name="trouble-area"><list1 type="unordered"><item><ptxt>Tire and wheel size</ptxt></item><item><ptxt>Tire deformation</ptxt></item><item><ptxt>Speed sensor rotor</ptxt></item><item><ptxt>Speed sensor</ptxt></item><item><ptxt>Speed sensor circuit</ptxt></item><item><ptxt>Brake actuator assembly (Skid control ECU)</ptxt></item></list1></data-name></entry></row></tbody></tgroup></table></content5></subpara><subpara id="RM100000000FKQC_03" category="10"><name>CAUTION / NOTICE / HINT</name><content5><atten4><ptxt>When DTCs C1401 to C1416 are output with DTC C1337, inspect and repair the trouble areas indicated by DTCs C1401 to C1416 first.</ptxt><ptxt>Click here<mlink><xref label="Seep00001" term-id-from="001" href="RM100000000FKQ7"/></mlink></ptxt></atten4></content5></subpara><subpara id="RM100000000FKQC_05" category="01"><name>PROCEDURE</name><testgrp id="RM100000000FKQC_05_0001" cellposition="1-1"><testtitle>CHECK TIRES</testtitle><content6><test1><ptxt>Check the size and condition of all 4 wheels.</ptxt><atten4><ptxt>The DTC is output when tire deformation or a difference in tire size is detected.</ptxt></atten4><spec type="other"><title>OK</title><specitem><ptxt>The diameter and air pressure of all 4 tires are the same.</ptxt></specitem></spec></test1><spec type="other"><title>Result</title><table><tgroup cols="1"><colspec colname="col1" colwidth="4.13in"/><thead><row><entry valign="middle" align="center"><ptxt>Proceed to</ptxt></entry></row></thead><tbody><row><entry valign="middle" align="center"><judge-value label="1"><ptxt>OK</ptxt></judge-value></entry></row><row><entry valign="middle" align="center"><judge-value label="2"><ptxt>NG</ptxt></judge-value></entry></row></tbody></tgroup></table></spec></content6><results><result label="1" cellposition="1-1"><action actiontype="next" cellposition="2-1" childid="RM100000000FKQC_05_0002"/></result><result label="2" cellposition="1-3"><action actiontype="end" cellposition="2-3"><actiontitle>REPLACE TIRES SO THAT ALL 4 TIRES ARE SAME SIZE</actiontitle><content6/></action></result></results></testgrp><testgrp id="RM100000000FKQC_05_0002" cellposition="2-1"><testtitle>RECONFIRM DTC</testtitle><content6><test1><ptxt>Clear the DTCs.</ptxt><ptxt>Click here<mlink><xref label="Seep00001" term-id-from="001" href="RM100000000FKQ3"/></mlink></ptxt><gts-info category="dtc-delete"><title>Chassis &gt; ABS/VSC/TRC &gt; Clear DTCs</title><gts-exec function-id="50002"><gts-ecu ecu-id="105"/></gts-exec><app-communication><app-param name="process-mode">0</app-param><app-param name="edit-mode">1</app-param><app-param name="insert-mode">0</app-param><app-param name="function-tab">0</app-param><app-param name="category-div">2</app-param><app-param name="category-div-name">Chassis</app-param><app-param name="ecu-id">105</app-param><app-param name="ecu-name">ABS/VSC/TRC</app-param><app-param name="gts-order">0</app-param><app-param name="selected-state">1</app-param></app-communication></gts-info></test1><test1><ptxt>Turn the ignition switch off.</ptxt></test1><test1><ptxt>Start the engine.</ptxt></test1><test1><ptxt>Drive the vehicle at a speed of 40 km/h (25 mph) or more for at least 60 seconds.</ptxt></test1><test1><ptxt>Check if the same DTC is output.</ptxt><ptxt>Click here<mlink><xref label="Seep00002" term-id-from="001" href="RM100000000FKQ3"/></mlink></ptxt><gts-info category="dtc-read"><title>Chassis &gt; ABS/VSC/TRC &gt; Trouble Codes</title><gts-exec function-id="50001"><gts-ecu ecu-id="105"/></gts-exec><app-communication><app-param name="process-mode">0</app-param><app-param name="edit-mode">1</app-param><app-param name="insert-mode">0</app-param><app-param name="function-tab">0</app-param><app-param name="category-div">2</app-param><app-param name="category-div-name">Chassis</app-param><app-param name="ecu-id">105</app-param><app-param name="ecu-name">ABS/VSC/TRC</app-param><app-param name="gts-order">0</app-param><app-param name="selected-state">0</app-param></app-communication></gts-info><spec type="other"><title>Result</title><table><tgroup cols="1"><colspec colname="col1" colwidth="4.13in"/><thead><row><entry valign="middle" align="center"><ptxt>Proceed to</ptxt></entry></row></thead><tbody><row><entry valign="middle" align="center"><judge-value label="1"><ptxt>DTC is output</ptxt></judge-value></entry></row><row><entry valign="middle" align="center"><judge-value label="2"><ptxt>DTC is not output</ptxt></judge-value></entry></row></tbody></tgroup></table></spec></test1></content6><results><result label="1" cellposition="2-1"><action actiontype="end" cellposition="3-1"><actiontitle>REPLACE BRAKE ACTUATOR ASSEMBLY</actiontitle><content6><ptxt>Click here<mlink><xref label="Seep00001" term-id-from="001" term-id-to="002" href="RM100000000FWYV"/><xref term-id-from="002" href="RM100000000YZ6Q"/></mlink></ptxt></content6></action></result><result label="2" cellposition="2-2"><action actiontype="end" cellposition="3-2"><actiontitle>USE SIMULATION METHOD TO CHECK</actiontitle><content6><ptxt>Click here<mlink><xref label="Seep00001" term-id-from="001" term-id-to="002" href="RM100000000G4HR"/><xref term-id-from="002" term-id-to="003" href="RM1000000010V0Q"/><xref term-id-from="003" href="RM10000000136PZ"/></mlink></ptxt></content6></action></result></results></testgrp></subpara></para></ttl></section></servcat></pub></tmc-service-paragraph>