<?xml version="1.0" encoding="UTF-8"?>
<!DOCTYPE tmc-service-paragraph SYSTEM "../dtd/paragraph-contents.dtd">
<tmc-service-paragraph><pub id="RM25T0E"><servcat id="_54"><name>Brake</name><section id="_029873"><name>BRAKE CONTROL / DYNAMIC CONTROL SYSTEMS</name><ttl id="_0135612"><name>ANTI-LOCK BRAKE SYSTEM</name><para id="RM100000000FKQS" category="J"><dtccode/><dtcname>Brake Warning Light Remains ON</dtcname><subpara id="RM100000000FKQS_01" category="03"><name>DESCRIPTION</name><content5><ptxt>When one of the following conditions is met, the brake warning light remains on:</ptxt><list1 type="unordered"><item><ptxt>The brake fluid level is insufficient.</ptxt></item><item><ptxt>The parking brake is applied.</ptxt></item><item><ptxt>The vacuum inside the brake booster decreases (for 1HZ and 1VD-FTV).</ptxt></item><item><ptxt>The brake warning light circuit is shorted.</ptxt></item></list1></content5></subpara><subpara id="RM100000000FKQS_02" category="03"><name>WIRING DIAGRAM</name><content5><figure type="1" translate="E"><graphic graphicname="C311982E01" width="7.168479331in" height="5.838041339in"/></figure></content5></subpara><subpara id="RM100000000FKQS_03" category="10"><name>CAUTION / NOTICE / HINT</name><content5><atten3><list1 type="unordered"><item><ptxt>for 1HZ and 1VD-FTV:</ptxt><ptxt>If there is a brake booster system malfunction, such as a problem with the response of the brake pedal when it is depressed, inspect the brake booster system first.</ptxt><ptxt>Brake booster inspection: Click here<mlink><xref label="Seep00001" term-id-from="001" href="RM100000000FWJX"/></mlink></ptxt><ptxt>Vacuum pump inspection: Click here<mlink><xref label="Seep00003" term-id-from="001" href="RM100000000FWK2"/></mlink> for 1HZ, Click here<mlink><xref label="Seep00002" term-id-from="001" href="RM100000000FWK9"/></mlink> for 1VD-FTV</ptxt></item><item><ptxt>Before disconnecting the connector, make sure that there are no problems with the connection.</ptxt></item><item><ptxt>After disconnecting the connector, make sure that the connector case and terminals are not deformed or corroded.</ptxt></item></list1></atten3></content5></subpara><subpara id="RM100000000FKQS_05" category="01"><name>PROCEDURE</name><testgrp id="RM100000000FKQS_05_0001" cellposition="1-1"><testtitle>INSPECT BRAKE MASTER CYLINDER RESERVOIR SUB-ASSEMBLY</testtitle><content6><test1><ptxt>Turn the ignition switch to ON.</ptxt></test1><test1><ptxt>With the brake fluid at the specified level, disconnect the A15*1 or I85*2 brake master cylinder reservoir sub-assembly (brake fluid level warning switch) connector and check the brake warning light.</ptxt><list1 type="nonmark"><item><ptxt>*1: for LHD</ptxt></item><item><ptxt>*2: for RHD</ptxt></item></list1><spec type="other"><title>Result</title><table><tgroup cols="1"><colspec colname="col1" colwidth="4.13in"/><thead><row><entry valign="middle" align="center"><ptxt>Proceed to</ptxt></entry></row></thead><tbody><row><entry valign="middle" align="center"><judge-value label="1"><ptxt>Brake warning light does not turn off</ptxt></judge-value></entry></row><row><entry valign="middle" align="center"><judge-value label="2"><ptxt>Brake warning light turns off</ptxt></judge-value></entry></row></tbody></tgroup></table></spec><atten4><ptxt>If the brake warning light turns off, the brake master cylinder reservoir sub-assembly (brake fluid level warning switch) has an internal short circuit.</ptxt></atten4></test1></content6><results><result label="1" cellposition="1-1"><action actiontype="next" cellposition="3-1" childid="RM100000000FKQS_05_0002"/></result><result label="2" cellposition="1-2"><action actiontype="end" cellposition="2-2"><actiontitle>REPLACE BRAKE MASTER CYLINDER RESERVOIR SUB-ASSEMBLY</actiontitle><content6><ptxt>Click here<mlink><xref label="Seep00001" term-id-from="001" term-id-to="002" href="RM100000000FWJL"/></mlink></ptxt></content6></action></result></results></testgrp><testgrp id="RM100000000FKQS_05_0002" cellposition="3-1"><testtitle>INSPECT PARKING BRAKE SWITCH ASSEMBLY</testtitle><content6><test1><ptxt>Remove the parking brake switch assembly.</ptxt><ptxt>Click here<mlink><xref label="Seep00001" term-id-from="001" href="RM100000000FV5H"/></mlink></ptxt></test1><test1><ptxt>Inspect the parking brake switch assembly.</ptxt><ptxt>Click here<mlink><xref label="Seep00002" term-id-from="001" href="RM100000000FV5I"/></mlink></ptxt><spec type="other"><title>Result</title><table><tgroup cols="1"><colspec colname="col1" colwidth="4.13in"/><thead><row><entry valign="middle" align="center"><ptxt>Proceed to</ptxt></entry></row></thead><tbody><row><entry valign="middle" align="center"><judge-value label="1"><ptxt>OK (for 1HZ and 1VD-FTV)</ptxt></judge-value></entry></row><row><entry valign="middle" align="center"><judge-value label="2"><ptxt>OK (except 1HZ and 1VD-FTV)</ptxt></judge-value></entry></row><row><entry valign="middle" align="center"><judge-value label="3"><ptxt>NG</ptxt></judge-value></entry></row></tbody></tgroup></table></spec></test1></content6><results><result label="1" cellposition="3-1"><action actiontype="next" cellposition="4-1" childid="RM100000000FKQS_05_0005"/></result><result label="2" cellposition="3-4"><action actiontype="jump" cellposition="4-4" childid="RM100000000FKQS_05_0008"><actiontitle>GO TO STEP 4</actiontitle></action></result><result label="3" cellposition="3-5"><action actiontype="end" cellposition="4-5"><actiontitle>REPLACE PARKING BRAKE SWITCH ASSEMBLY</actiontitle><content6><ptxt>Click here<mlink><xref label="Seep00001" term-id-from="001" href="RM100000000FV5H"/></mlink></ptxt></content6></action></result></results></testgrp><testgrp id="RM100000000FKQS_05_0005" cellposition="4-1"><testtitle>INSPECT VACUUM WARNING SWITCH ASSEMBLY</testtitle><content6><test1><ptxt>Start the engine.</ptxt></test1><test1><ptxt>Idle the engine.</ptxt></test1><test1><ptxt>Disconnect the I32 vacuum warning switch connector and check the brake warning light.</ptxt><spec type="other"><title>Result</title><table><tgroup cols="1"><colspec colname="col1" colwidth="4.13in"/><thead><row><entry valign="middle" align="center"><ptxt>Proceed to</ptxt></entry></row></thead><tbody><row><entry valign="middle" align="center"><judge-value label="1"><ptxt>Brake warning light does not turn off</ptxt></judge-value></entry></row><row><entry valign="middle" align="center"><judge-value label="2"><ptxt>Brake warning light turns off</ptxt></judge-value></entry></row></tbody></tgroup></table></spec><atten4><ptxt>If the brake warning light turns off, the vacuum warning switch has an internal short circuit.</ptxt></atten4></test1></content6><results><result label="1" cellposition="4-1"><action actiontype="next" cellposition="5-1" childid="RM100000000FKQS_05_0008"/></result><result label="2" cellposition="4-3"><action actiontype="end" cellposition="5-3"><actiontitle>REPLACE VACUUM WARNING SWITCH ASSEMBLY</actiontitle><content6><ptxt>Click here<mlink><xref label="Seep00001" term-id-from="001" href="RM100000000G6B2"/></mlink></ptxt></content6></action></result></results></testgrp><testgrp id="RM100000000FKQS_05_0008" cellposition="5-1"><testtitle>CHECK HARNESS AND CONNECTOR (BRAKE WARNING LIGHT CIRCUIT)</testtitle><content6><test1><ptxt>Turn the ignition switch off.</ptxt></test1><test1><ptxt>Disconnect the L25 and L26 combination meter assembly connectors.</ptxt></test1><test1><ptxt>Measure the resistance according to the value(s) in the table below.</ptxt><spec type="resistance"><title>Standard Resistance</title><table pgwide="1"><tgroup cols="3"><colspec colname="col1" colwidth="3.89in"/><colspec colname="col2" colwidth="1.06in"/><colspec colname="col3" colwidth="2.13in"/><thead><row><entry valign="middle" align="center"><ptxt>Tester Connection</ptxt></entry><entry valign="middle" align="center"><ptxt>Condition</ptxt></entry><entry valign="middle" align="center"><ptxt>Specified Condition</ptxt></entry></row></thead><tbody><row><entry valign="middle" align="center"><ptxt>L25-20 (PKBI) or S3-1 - Body ground</ptxt></entry><entry valign="middle" align="center"><ptxt>Always</ptxt></entry><entry valign="middle" align="center"><ptxt>10 kΩ or higher</ptxt></entry></row><row><entry valign="middle" align="center"><ptxt>L26-3 (SW) or A15-1 (+)*1 or I85-1 (+)*2 - Body ground</ptxt></entry><entry valign="middle" align="center"><ptxt>Always</ptxt></entry><entry valign="middle" align="center"><ptxt>10 kΩ or higher</ptxt></entry></row><row><entry valign="middle" align="center"><ptxt>L26-3 (SW) or I32-1*3 - Body ground</ptxt></entry><entry valign="middle" align="center"><ptxt>Always</ptxt></entry><entry valign="middle" align="center"><ptxt>10 kΩ or higher</ptxt></entry></row></tbody></tgroup></table></spec><list1 type="nonmark"><item><ptxt>*1: for LHD</ptxt></item><item><ptxt>*2: for RHD</ptxt></item><item><ptxt>*3: for 1HZ and 1VD-FTV</ptxt></item></list1></test1><spec type="other"><title>Result</title><table><tgroup cols="1"><colspec colname="col1" colwidth="4.13in"/><thead><row><entry valign="middle" align="center"><ptxt>Proceed to</ptxt></entry></row></thead><tbody><row><entry valign="middle" align="center"><judge-value label="1"><ptxt>OK</ptxt></judge-value></entry></row><row><entry valign="middle" align="center"><judge-value label="2"><ptxt>NG</ptxt></judge-value></entry></row></tbody></tgroup></table></spec></content6><results><result label="1" cellposition="5-1"><action actiontype="end" cellposition="6-1"><actiontitle>GO TO METER / GAUGE SYSTEM</actiontitle><content6><ptxt>Click here<mlink><xref label="Seep00001" term-id-from="001" term-id-to="002" href="RM100000000FSUM"/></mlink></ptxt></content6></action></result><result label="2" cellposition="5-2"><action actiontype="end" cellposition="6-2"><actiontitle>REPAIR OR REPLACE HARNESS OR CONNECTOR</actiontitle><content6/></action></result></results></testgrp></subpara></para></ttl></section></servcat></pub></tmc-service-paragraph>