<?xml version="1.0" encoding="UTF-8"?>
<!DOCTYPE tmc-service-paragraph SYSTEM "../dtd/paragraph-contents.dtd">
<tmc-service-paragraph><pub id="RM25T0E"><servcat id="_53"><name>Suspension</name><section id="_062777"><name>TIRE PRESSURE MONITORING</name><ttl id="_0306275"><name>TIRE PRESSURE WARNING SYSTEM</name><para id="RM1000000012NTY" category="C"><dtccode>C2198/98</dtccode><dtcname>Initialization Switch (for Test Mode DTC)</dtcname><subpara id="RM1000000012NTY_02" category="03"><name>DESCRIPTION</name><content5><ptxt>During test mode, when the tire pressure warning reset switch is on, the tire pressure warning light comes on and when the tire pressure warning reset switch is off, the tire pressure warning light blinks at 0.125 second intervals.</ptxt><table type="dtc-explan-table" pgwide="1"><tgroup cols="4"><colspec colname="1" colwidth="1.06in"/><colspec colname="2" colwidth="1.42in"/><colspec colname="3" colwidth="2.12in"/><colspec colname="4" colwidth="2.48in"/><thead><row><entry align="center" valign="middle"><ptxt>DTC No.</ptxt></entry><entry align="center" valign="middle"><ptxt>Detection Item</ptxt></entry><entry align="center" valign="middle"><ptxt>DTC Detection Condition</ptxt></entry><entry align="center" valign="middle"><ptxt>Trouble Area</ptxt></entry></row></thead><tbody><row><entry align="left" valign="middle"><data-name name="dtc-code"><ptxt>C2198/98</ptxt></data-name></entry><entry align="left" valign="middle"><data-name name="detect-item"><ptxt>Initialization Switch (for Test Mode DTC)</ptxt></data-name></entry><entry align="left" valign="middle"><data-name name="dtc-detect-cond"><ptxt>Test mode procedure is performed.</ptxt></data-name></entry><entry align="left" valign="middle"><data-name name="trouble-area"><list1 type="unordered"><item><ptxt>Tire pressure warning reset switch</ptxt></item><item><ptxt>Wire harness or connector</ptxt></item><item><ptxt>Tire pressure warning ECU and receiver</ptxt></item></list1></data-name></entry></row></tbody></tgroup></table></content5></subpara><subpara id="RM1000000012NTY_03" category="03"><name>WIRING DIAGRAM</name><content5><figure type="1" translate="E"><graphic graphicname="C249283E44" width="7.168479331in" height="3.812598425in"/></figure></content5></subpara><subpara id="RM1000000012NTY_04" category="10"><name>CAUTION / NOTICE / HINT</name><content5><atten3><list1 type="unordered"><item><ptxt>When replacing the tire pressure warning ECU and receiver, read the transmitter IDs stored in the old ECU using the GTS and write them down before removal.</ptxt></item><item><ptxt>It is necessary to perform initialization <mlink><xref label="Seep00001" term-id-from="003" href="RM1000000012NUB"/></mlink> after registration <mlink><xref label="Seep00002" term-id-from="003" href="RM1000000012NUA"/></mlink> of the transmitter IDs into the tire pressure warning ECU and receiver if the ECU has been replaced.</ptxt></item></list1></atten3></content5></subpara><subpara id="RM1000000012NTY_01" category="01"><name>PROCEDURE</name><testgrp id="RM1000000012NTY_01_0001" cellposition="1-1"><testtitle>INSPECT TIRE PRESSURE WARNING RESET SWITCH</testtitle><content6><test1><ptxt>Turn the ignition switch off.</ptxt></test1><test1><ptxt>Remove the tire pressure warning reset switch.</ptxt><ptxt>Click here<mlink><xref label="Seep00001" term-id-from="003" href="RM1000000013GKP"/></mlink></ptxt></test1><test1><ptxt>Inspect the tire pressure warning reset switch.</ptxt><ptxt>Click here<mlink><xref label="Seep00002" term-id-from="003" href="RM1000000013GKN"/></mlink></ptxt></test1><spec type="other"><title>Result</title><table><tgroup cols="1"><colspec colname="col1" colwidth="4.13in"/><thead><row><entry align="center"><ptxt>Proceed to</ptxt></entry></row></thead><tbody><row><entry align="center"><judge-value label="1"><ptxt>OK</ptxt></judge-value></entry></row><row><entry align="center"><judge-value label="2"><ptxt>NG</ptxt></judge-value></entry></row></tbody></tgroup></table></spec></content6><results><result label="1" cellposition="1-1"><action actiontype="next" cellposition="2-1" childid="RM1000000012NTY_01_0002"/></result><result label="2" cellposition="1-3"><action actiontype="end" cellposition="2-3"><actiontitle>REPLACE TIRE PRESSURE WARNING RESET SWITCH</actiontitle><content6><ptxt>Click here<mlink><xref label="Seep00001" term-id-from="003" href="RM1000000013GKP"/></mlink></ptxt></content6></action></result></results></testgrp><testgrp id="RM1000000012NTY_01_0002" cellposition="2-1"><testtitle>CHECK HARNESS AND CONNECTOR (TIRE PRESSURE WARNING RESET SWITCH - TIRE PRESSURE WARNING ECU AND RECEIVER)</testtitle><content6><test1><ptxt>Disconnect the L56 tire pressure warning reset switch connector.</ptxt></test1><test1><ptxt>Disconnect the S30*1, Y7*2 or U5*3 tire pressure warning ECU and receiver connector.</ptxt><list1 type="nonmark"><item><ptxt>*1: for Single Cab</ptxt></item><item><ptxt>*2: for Double Cab</ptxt></item><item><ptxt>*3: except Single and Double Cabs</ptxt></item></list1></test1><test1><ptxt>Measure the resistance according to the value(s) in the table below.</ptxt><spec type="resistance"><title>Standard Resistance</title><table><tgroup cols="3"><colspec colname="col1" colwidth="1.65in"/><colspec colname="col2" colwidth="1.03in"/><colspec colname="col3" colwidth="1.45in"/><thead><row><entry valign="middle" align="center"><ptxt>Tester Connection</ptxt></entry><entry valign="middle" align="center"><ptxt>Condition</ptxt></entry><entry valign="middle" align="center"><ptxt>Specified Condition</ptxt></entry></row></thead><tbody><row><entry valign="middle" align="center"><ptxt>S30-7 (CLSW) - L56-1 (INT)*1</ptxt><ptxt>Y7-7 (CLSW) - L56-1 (INT)*2</ptxt><ptxt>U5-7 (CLSW) - L56-1 (INT)*3</ptxt></entry><entry valign="middle" align="center"><ptxt>Always</ptxt></entry><entry valign="middle" align="center"><ptxt>Below 1 Ω</ptxt></entry></row><row><entry valign="middle" align="center"><ptxt>S30-7 (CLSW) or L56-1 (INT) - Body ground*1</ptxt><ptxt>Y7-7 (CLSW) or L56-1 (INT) - Body ground*2</ptxt><ptxt>U5-7 (CLSW) or L56-1 (INT) - Body ground*3</ptxt></entry><entry valign="middle" align="center"><ptxt>Always</ptxt></entry><entry valign="middle" align="center"><ptxt>10 kΩ or higher</ptxt></entry></row><row><entry valign="middle" align="center"><ptxt>L56-2 (E) - Body ground</ptxt></entry><entry valign="middle" align="center"><ptxt>Always</ptxt></entry><entry valign="middle" align="center"><ptxt>Below 1 Ω</ptxt></entry></row></tbody></tgroup></table></spec><list1 type="nonmark"><item><ptxt>*1: for Single Cab</ptxt></item><item><ptxt>*2: for Double Cab</ptxt></item><item><ptxt>*3: except Single and Double Cabs</ptxt></item></list1><spec type="other"><title>Result</title><table><tgroup cols="1"><colspec colname="col1" colwidth="4.13in"/><thead><row><entry align="center" valign="middle"><ptxt>Proceed to</ptxt></entry></row></thead><tbody><row><entry align="center" valign="middle"><judge-value label="1"><ptxt>OK</ptxt></judge-value></entry></row><row><entry align="center" valign="middle"><judge-value label="2"><ptxt>NG</ptxt></judge-value></entry></row></tbody></tgroup></table></spec></test1></content6><results><result label="1" cellposition="2-1"><action actiontype="end" cellposition="3-1"><actiontitle>REPLACE TIRE PRESSURE WARNING ECU AND RECEIVER</actiontitle><content6><ptxt>for Single Cab: Click here<mlink><xref label="Seep00001" term-id-from="003" href="RM1000000013GKS"/></mlink></ptxt><ptxt>for Double Cab: Click here<mlink><xref label="Seep00002" term-id-from="003" href="RM1000000013GKS"/></mlink></ptxt><ptxt>for Short Body: Click here<mlink><xref label="Seep00003" term-id-from="003" href="RM1000000013GKK"/></mlink></ptxt><ptxt>for Long Body: Click here<mlink><xref label="Seep00004" term-id-from="003" href="RM1000000013GKW"/></mlink></ptxt><ptxt>for Semi-long Body: Click here<mlink><xref label="Seep00005" term-id-from="003" href="RM1000000013GKZ"/></mlink></ptxt></content6></action></result><result label="2" cellposition="2-2"><action actiontype="end" cellposition="3-2"><actiontitle>REPAIR OR REPLACE HARNESS OR CONNECTOR</actiontitle><content6/></action></result></results></testgrp></subpara></para></ttl></section></servcat></pub></tmc-service-paragraph>